,Unnamed: 0,label,concatenated,wordcount
0,0.0,ՁԱԽՈՐԴ ՓԱՆՈՍԸ,ժամանակով մի աղքատ մարդ է լինում անունը փանոս ինքը մի բարի մարդ է լինում     բայց ինչ գործ որ բռնում է ձախ է գնում դրա համար էլ անունը դնում են ձախորդ     փանոս ունեցածչունեցածը մի լուծ եզն է լինում մի սել ու մի կացին մի օր եզները սելում լծում է կացինը առնում գնում անտառը փետի անտառում էս     փանոսը միտք է անում թե մի բան որ ծառը կտրելուց ետը մին էլ նեղություն պետք     է քաշեմ ահագին գերանը գետնից բարձրացնեմ գցեմ սելի մեջը ավելի լավ է հենց     սելը լծած բերեմ ծառի տակին կանգնեցնեմ որ ծառը կտրեմ թե չէ ընկնի մեջը ասածն արած է եզներով սելը բերում է մի մեծ ծառի ներքև կանգնեցնում ինքը անցնում է վերի     կողմը կացինը քաշում թրխկ հա թրխկ շատ է քաշում թե քիչ էդ էլ ինքը կիմանա     ծառը ճռճռալով գալիս է զարկում տակովն անում սելը ջարդում եզներն էլ հետը     փանոսը մնում է ապշած կանգնած ինչ պետք է անի կացինը վերցնում է ու ծոծրակը     քորելով ճամփա է ընկնում դեպի տուն ճամփին մի լճի ափով անց կենալիս է լինում տեսնում է մեջը վայրի բադեր են լողում     ասում է գլուխը քարը չեղավ չեղավ արի գոնե մի բադ սպանեմ տանեմ տամ կնկանս     ասում է ու կացինը պտտում շպրտում դեպի բադերը որ մինն սպանի բադերը ճղճղալով     ցրվում են փախչում են որը եղեգնուտն է մտնում որը թռչում գնում կացինն էլ     ընկնում է լճի խոր տեղը տակն անում կորչում փանոսը մնում է լճի ափին կանգնած     միտք անելիս ինչ անի ինչ չանի շորերը հանում է դնում լճի ափին ինքը մտնում     մեջը որ կացինը հանի գնում է գնում քանի առաջ է գնում ջուրն էնքան խորանում     է տեսնում է կարող է խեղդվել ետ է դառնում դուրս գալի դու մի՛ ասիլ փանոսը որ լիճն է մտնում ու խորը գնում էդ ժամանակ լճափով մի     անցկենող է լինում տեսնում է էստեղ թափած շորեր կան եղեգնուտի մեջ խորը գնացած     փանոսին էլ չի նկատում էս շորերը հավաքում է առնում գնում փանոսը լճից դուրս է գալի տեսնում շոր չկա մնում է տկլոր կանգնած միտք է անում  ինչ անեմ տեր աստված էսպես տկլոր ուր գնամ  սպասում է մինչև մութն ընկնի մթան հետ վեր է կենում գնում գյուղը որ գյուղին     մոտենում է ասում է էսպես տկլոր որ գնամ մեր տունը տանըցիք ինչ կասեն արի     գնամ ախպորիցս շոր առնեմ հագնեմ էնպես գնամ կնկանս մոտ ճամփեն ծռում է դեպի ախպոր տունը դո´ւ մի ասիլ էդ գիշեր էլ ախպոր մոտ մեծարք կա քեֆի էլ էն տաք ժամանակն է     դուռը ծերպ է անում տեսնի ով կա ով չկա հյուրերից մինը կարծում է թե շունն     է ձեռի կրծած ոսկորը շպրտում է դեպի դուռը ոսկորը դիպչում է աչքին աչքը հանում փանոսը ցավից վայվայ անելով ետ է դառնում շներն էս ձենի վրա վեր են կենում     տեսնում են օհո՛ մթնումը հրես մի տկլոր օքմին ու չորս կողմից վրա են տալիս     շների հաչոցի վրա մարդիկ դուրս են թափվում տեսնում են մի տկլոր մարդ փախած     գնում է շները ետևից առանց երկար ու բարակ մտածելու վճռում են որ կա թե չկա     սա սատանա է բավական տեղ ղըչըղու տալով հայհոյելով հարայհրոցով ընկնում են ետևից հալածում     տանում գցում անտառները շներն էլ ետևիցը մի ճուռը պոկում են ու էսպես տկլոր աչքը հանած կաղին տալով     խեղճ փանոսը գնում է կորչում մյուս օրը գյուղում տարածվում է թե հապա չեք ասիլ  փանոսը կորել է գնացել     է անտառը փետի ու ետ չի եկել  գեղահավան հավաքվում են գնում գնում են անտառը     ման գալի սելն ու եզները գտնում են ծառի տակին ջարդված ինքը չկա դես փանոս դեն փանոս հարց ու փորձով հագուստն էլ գտնում են մեկի մոտ — ա՛յ մարդ էս հագուստը որտեղից է ընկել քեզ մոտ — թե ախպեր էս հագուստը էսպես մի լճի ափին վեր ածած էր հավաքեցի բերի գնում են լճի չորս կողմը պտտում կանչում  փանոս փանոս  փանոսը չկա վճռում են որ փանոսը խեղդվել է գալիս են ժամ ու պատարագ են անում քելեխը տալիս կնիկն էլ մի քիչ սուգ է անում     փանոսին գովում ափսոսում հետո մի ուրիշ մարդ է ուզում հետը պսակվում գնում  հեքիաթներ     թումանյանի թարգմանությամբ   աղբյուր հովհաննես թումանյան  հեքիաթներ           սովետական գրող  երևան 1978թ տրամադրել է մ յալանուզյան  թումանյանի ստեղծագործությունները հայերեն           և ռուսերենenglish translations           of tumanyan's poetry by alice           stone blackwell,656
